Name,Function,Details,Saturday,Sunday,Monday,Tuesday,Wednesday,Thursday,Friday,Score,NumOfReviews,Indoor/Outdoors,Longitude,Latitude,Image
Yangjae Citizens' Forest,Park,"1980년대 개포지구 토지구획 정리사업의 일환으로 1983년에 착공하고 1986년 11월에 완공하여 문을 열었다. 1986년의 서울아시아경기대회와 1988년의 제24회 올림픽경기대회를 위해 서울특별시의 관문인 양재 톨게이트 주변에 조성한 공원으로, 다양한 수종의 숲이 볼만하다. 면적은 총 25만 8,992㎡이며 그 중 녹지대가 20만 5872㎡, 주차장이 5,972㎡, 광장이 7,211㎡, 기타 시설이 3만 9937㎡를 차지한다. 주요 시설물로는 조경시설로 잔디광장과 파고라(그늘막) 등이 있고 운동시설로 배구장·배드민턴장·테니스장이 있다.",Open 24 hours,Open 24 hours,Open 24 hours,Open 24 hours,Open 24 hours,Open 24 hours,Open 24 hours,4.4,486,Outdoor,127.0333837,37.4706864,Yangjae Citizens' Forest.jpg
Olympic Stadium,Stadium,"면적 54만 5000m2. 수용능력 20만 명. 동대문운동장과 장충체육관 등 기존시설만으로는 국내외의 스포츠 수요에 대응하기 어려움을 감안하여 서울시가 1976년 10월 건설기본계획을 수립하였다. 대한탁구협회가 건설할 계획이었던 사라예보 세계탁구제패 기념관을 흡수하여 이를 종합운동장 내의 실내체육관으로 확장 건설할 것을 결정했다. 실내체육관(7,000평 : 수용능력 2만 명)은 1979년 4월에 준공 ·개관하였고, 실내수영장(6000평 : 4,500명 수용)도 1980년 12월에 완공하였다. 1982년 6월 야구장(1만 8000평 : 5만 명 수용능력)이 준공되었고, 시설면적 4만 평에 수용인원 10만 명, 2층 구조 관람석을 갖춘 주경기장도 1984년 9월에 개장하였다. 이 밖에 보조경기장(2만 명 수용능력) ·데크플라자 ·주차장 ·녹지 등이 조성되었다. 지하철 2호선의 운동장 앞 경유, 입체교차로, 지하보도 등의 설치로 교통 소통을 원활히 하고 단지내에 기념탑과 기타 각종 편의시설을 갖추었다",,,,,,,,4.2,909,Outdoor,127.0707589,37.5153144,Olympic Stadium.jpg
Songpa Naru Park (Seokchon Lake Park),Park,"서울특별시 송파구 잠실동에 있는 호수로, 한강매립사업을 통해 형성되었다. 호수의 면적은 21만 7,850㎡이며 담수량은 636만t, 평균수심은 4.5m이다. 호수 조성 후 송파대로(서울 송파구의 남북을 가로지르는 간선도로)가 호수를 가로질러 가게 되면서부터 동호(東湖, 10만 5,785㎡)와 서호(西湖, 11만 2,065㎡)로 구분됐다.",Open 24 hours,Open 24 hours,Open 24 hours,Open 24 hours,Open 24 hours,Open 24 hours,Open 24 hours,4.4,510,Outdoor,127.1008244,37.5097431,Songpa Naru Park (Seokchon Lake Park).jpg
Garak Market,Market,"시장은 청과시장, 채소시장, 건고추매장, 마늘매장, 수산시장, 건어물경매장, 축산시장, 직판시장, 청과관련시장, 건어물관련시장, 건어물창고 및 가공처리장, 냉동창고, 서비스동, 축산물직판장, 주유소, 주차장, 관리금융동으로 구분되어 있다. 청과시장은 462개의 점포, 수산시장은 206개의 점포, 축산시장은 육가공실·저장고, 주차장은 동시주차능력 4,850대를 갖추었다. 이밖의 시설로는 도축장, 소매시장, 수산관련 상품시장, 트럭단위 판매장 등이 있다. 편의시설로는 은행·우체국·관리사무실·유통정보실 등이 수용된 관리금융동과 휴게실·목욕탕·식당·이발관·매점 등의 휴식시설동이 있으며, 출하자와 반입차량의 운전 기사를 위한 무료휴게실이 마련되어 있다.",Open 24 hours,Open 24 hours,Open 24 hours,Open 24 hours,Open 24 hours,Open 24 hours,Open 24 hours,4,"1,171",indoor,127.1126744,37.4928569,Garak Market.jpg
Ttukseom Han River Park,Park,"한강공원이 조성되기 이전부터 강변유원지로 유명했던 곳입니다. 수상에서는 시원한 바람을 맞으며 낭만과 젊음을 만끽할 수 있는 윈드서핑, 수상스키, 모터보트 등 수상스포츠가 활발하게 이루어지고 있습니다.",Open 24 hours,Open 24 hours,Open 24 hours,Open 24 hours,Open 24 hours,Open 24 hours,Open 24 hours,4.3,"1,009",Outdoor,127.0678368,37.5291052,Ttukseom Han River Park.jpg
Seoul City Hall,City or Town Hall,서울특별시의 자치행정을 총괄하는 행정기관.,Closed,Closed,9AM–6PM,9AM–6PM,9AM–6PM,9AM–6PM,9AM–6PM,4,195,Indoor,126.9732605,37.5615506,Seoul City Hall.jpg
Seoul Station,Subway Station,"대한민국 철도교통의 심장.

서울특별시의 중앙역. 간선철도 경부선, 경의선과 인천국제공항철도의 기점이자 수도권 전철 1호선 경부선 구간과 수도권 전철 경의·중앙선의 기점이며 수도권 전철 4호선이 지나간다. 경부선이 철도의 대동맥이라면 이 곳은 대한민국 철도의 시점 겸 종점.",,,,,,,,4.2,198,Indoor/Outdoors,126.9608648,37.5536067,Seoul Station.jpg
North Seoul Dream Forest,Park,"다른 지역에 비해 공원이 부족한 서울 동북부 지역의 시민들에게 도심 속에서 자연을 느낄 수 있는 휴식 공간을 제공하는 데 목적이 있다. 숲의 형태는 친환경적 요소를 강조해 공원 전체에 걸쳐 지름 30~40㎝에 높이 20m의 나무 104종 42만 그루를 옮겨 심는다. 대표적인 나무 종은 참나무·서어나무·산벚나무 등이며, 한국 고유종이 대부분을 차지한다. 5개의 테마로 조성되는데, 제1테마는 뚝섬 문화예술공원으로, 광장·야외무대·아틀리에·게이트볼장·인공연못 등 시민들이 다양한 여가 활동을 즐길 수 있는 곳이다. 제2테마는 뚝섬 생태숲으로, 야생동물이 서식할 수 있도록 자연 그대로의 숲을 재현한 곳이다. 꽃사슴·고라니·다람쥐·다마사슴 등을 풀어 놓은 곳으로 가이드 동반하여 출입도 가능하다. 472m의 보행다리는 한강 선착장과 연결된다.",Open 24 hours,Open 24 hours,Open 24 hours,Open 24 hours,Open 24 hours,Open 24 hours,Open 24 hours,4.4,945,Outdoor,127.0384306,37.6214313,North Seoul Dream Forest.jpg
Noryangjin Fisheries Wholesale Market,Market,"서울특별시가 개설한 도매시장으로, 주력 사업은 생산자와 소비자의 이익을 보호하기 위해 전국에서 위탁된 대량·다종의 수산물을 공개경쟁매매 또는 정가·수의매매 등으로 판매하는 수탁판매(경매) 사업이다. 그밖에 주력사업의 효율적인 운영을 위해 부대시설 임대, 얼음 제조 및 판매, 냉동창고 운영, 주차장 운영 사업 등 부대사업을 수행한다. 주요 시설은 활어·선어·패류 등의 경매장(2,106평), 건어·젓갈 판매장(2,564평), 활어보관장, 중도매인사무실(2,308평), 출하주 휴게실, 간이 냉장고, 주차장(9,387평), 식당·약국·커피숍 같은 편의시설(712평) 등이다.",Open 24 hours,Open 24 hours,Open 24 hours,Open 24 hours,Open 24 hours,Open 24 hours,Open 24 hours,3.8,"7,033",Indoor/Outdoors,126.9386684,37.5152131,Noryangjin Fisheries Wholesale Market.jpg
Boramae Park,Park,"면적 40만 7529m2. 공군사관학교로 쓰여오다가 1985년 12월 서울시에서 인수, 1986년 5월에 복지시설 위주의 시립공원으로 개원하였다. 주요 시설물로는 대운동장을 비롯하여 잔디광장, 독서실, 청소년수련장, 소동물원, 체육관, 수영장, 장애자복지관, 남부노인종합복지관 등이 있으며, 그 밖에 연못, 녹지, 산책로, 조깅코스 등이 마련되어 있다. ",Open 24 hours,Open 24 hours,Open 24 hours,Open 24 hours,Open 24 hours,Open 24 hours,Open 24 hours,4.3,"1,824",Outdoor,126.9057464,37.5152079,보라매공원.jpg
Lotte World Tower,Tourist Attraction,"대한민국에서 가장 높은 마천루[5]

서울특별시 송파구 신천동 롯데월드몰에 있는 초고층 빌딩으로 국내 최초로 100층을 넘긴 최고층(지상 123층) 건물이자 새로운 랜드마크다.",10AM–10PM,10AM–10PM,10AM–10PM,10AM–10PM,10AM–10PM,10AM–10PM,10AM–10PM,4.3,"13,492",Indoor/Outdoors,127.1013039,37.5131507,Lotte World Tower.jpg
Starfield Coex Mall,Mall,서울 강남구 삼성동에 위치한 대형 쇼핑몰&복합문화공간. 국내에 거의 최초로 들어선 복합쇼핑몰로 2000년 5월 코엑스몰이란 명칭으로 개장한 이후 명성을 떨치다 2016년 스타필드가 들어서며 스타필드 코엑스몰로 명칭이 변경되었다.,10:30AM–10PM,10:30AM–10PM,10:30AM–10PM,10:30AM–10PM,10:30AM–10PM,10:30AM–10PM,10:30AM–10PM,4.2,"8,899",Indoor,127.056914,37.5116833,Starfield Coex Mall.jpg
Seodaemun Independence Park,Park,"일제강점기에 의병투쟁, 3·1독립만세운동, 항일투쟁 등으로 투옥되어 옥고를 치르다 순국한 선열들을 기리기 위하여 조성되었다. 이곳의 옥사는 1908년 일제가 침략을 본격화하기 위하여 지은 근대식 감옥으로, 경성감옥이라는 명칭으로 문을 열었는데 항일투사들이 늘어나자 일제가 마포구 공덕동에 새로 감옥을 지어 1912년에 서대문감옥으로 명칭을 바꾸었다. 그후 1923년에는 서대문형무소로, 1946년에는 경성형무소로, 1950년에는 서울형무소로 바뀌었고 1961년에는 서울교도소로 개칭되었다가 1967년 7월에 서울구치소로 바뀌는 등 여러 차례 그 명칭이 바뀌었다.",Open 24 hours,Open 24 hours,Open 24 hours,Open 24 hours,Open 24 hours,Open 24 hours,Open 24 hours,4.5,53,Outdoor,126.9541663,37.5740613,서대문독립공원.jpg
Seodaemun Museum of Natural History,Natural History Museum,"Modern natural history museum with dinosaur skeletons, butterflies & fossil exhibits.",10AM–7PM,10AM–7PM,Closed,10AM–6PM,10AM–6PM,10AM–6PM,10AM–6PM,4.2,883,Indoor,126.9344615,37.5759115,Seodaemun Museum of Natural History.jpg